{
  "$schema": "../../schemas/starting-equipment.schema.json",
  "formatVersion": 1,
  "system": "dnd5e",
  "kind": "pc",
  "step": "equipment",
  "from": [
    "class",
    "background"
  ],
  "equip": [
    "Armor",
    "Weapon"
  ],
  "packages": [
    {"for":"ID_WOTC_PHB_CLASS_BARBARIAN","options":[{"id":"equipment","label":"Starting equipment","lines":[{"choose":[{"items":[{"id":"ID_WOTC_PHB_WEAPON_GREATAXE"}]},{"picks":[{"label":"a martial melee weapon","types":["Weapon"],"supports":"ID_INTERNAL_WEAPON_CATEGORY_MARTIAL_MELEE","publications":["Player’s Handbook"]}]}]},{"choose":[{"items":[{"id":"ID_WOTC_PHB_WEAPON_HANDAXE","quantity":2}]},{"picks":[{"label":"a simple weapon","types":["Weapon"],"supports":"ID_INTERNAL_WEAPON_CATEGORY_SIMPLE_MELEE||ID_INTERNAL_WEAPON_CATEGORY_SIMPLE_RANGED","publications":["Player’s Handbook"]}]}]},{"items":[{"id":"ID_WOTC_ITEM_EXPLORERS_PACK"},{"id":"ID_WOTC_PHB_WEAPON_JAVELIN","quantity":4}]}]},{"id":"wealth","label":"Starting wealth instead","wealth":{"dice":"2d4","multiplier":10,"unit":"gp"}}]},
    {"for":"ID_WOTC_PHB_CLASS_BARD","options":[{"id":"equipment","label":"Starting equipment","lines":[{"choose":[{"items":[{"id":"ID_WOTC_PHB_WEAPON_RAPIER"}]},{"items":[{"id":"ID_WOTC_PHB_WEAPON_LONGSWORD"}]},{"picks":[{"label":"a simple weapon","types":["Weapon"],"supports":"ID_INTERNAL_WEAPON_CATEGORY_SIMPLE_MELEE||ID_INTERNAL_WEAPON_CATEGORY_SIMPLE_RANGED","publications":["Player’s Handbook"]}]}]},{"choose":[{"items":[{"id":"ID_WOTC_ITEM_DIPLOMATS_PACK"}]},{"items":[{"id":"ID_WOTC_ITEM_ENTERTAINERS_PACK"}]}]},{"choose":[{"items":[{"id":"ID_WOTC_SRD_INSTRUMENT_LUTE"}]},{"picks":[{"label":"another musical instrument","from":["ID_WOTC_SRD_INSTRUMENT_BAGPIPES","ID_WOTC_SRD_INSTRUMENT_DRUM","ID_WOTC_SRD_INSTRUMENT_DULCIMER","ID_WOTC_SRD_INSTRUMENT_FLUTE","ID_WOTC_SRD_INSTRUMENT_LUTE","ID_WOTC_SRD_INSTRUMENT_LYRE","ID_WOTC_SRD_INSTRUMENT_HORN","ID_WOTC_SRD_INSTRUMENT_PANFLUTE","ID_WOTC_SRD_INSTRUMENT_SHAWM","ID_WOTC_SRD_INSTRUMENT_VIOL"]}]}]},{"items":[{"id":"ID_WOTC_ARMOR_LIGHT_LEATHER"},{"id":"ID_WOTC_PHB_WEAPON_DAGGER"}]}]},{"id":"wealth","label":"Starting wealth instead","wealth":{"dice":"5d4","multiplier":10,"unit":"gp"}}]},
    {"for":"ID_WOTC_PHB_CLASS_CLERIC","options":[{"id":"equipment","label":"Starting equipment","lines":[{"choose":[{"items":[{"id":"ID_WOTC_PHB_WEAPON_MACE"}]},{"items":[{"id":"ID_WOTC_PHB_WEAPON_WARHAMMER"}]}]},{"choose":[{"items":[{"id":"ID_WOTC_ARMOR_MEDIUM_SCALE_MAIL"}]},{"items":[{"id":"ID_WOTC_ARMOR_LIGHT_LEATHER"}]},{"items":[{"id":"ID_WOTC_ARMOR_HEAVY_CHAIN_MAIL"}]}]},{"choose":[{"items":[{"id":"ID_WOTC_PHB_WEAPON_CROSSBOW_LIGHT"},{"id":"ID_WOTC_PHB_ITEM_CROSSBOWBOLT","quantity":20}]},{"picks":[{"label":"a simple weapon","types":["Weapon"],"supports":"ID_INTERNAL_WEAPON_CATEGORY_SIMPLE_MELEE||ID_INTERNAL_WEAPON_CATEGORY_SIMPLE_RANGED","publications":["Player’s Handbook"]}]}]},{"choose":[{"items":[{"id":"ID_WOTC_ITEM_PRIESTS_PACK"}]},{"items":[{"id":"ID_WOTC_ITEM_EXPLORERS_PACK"}]}]},{"items":[{"id":"ID_WOTC_GEAR_SHIELD"}],"picks":[{"label":"a holy symbol","from":["ID_WOTC_PHB_ITEM_AMULET","ID_WOTC_PHB_ITEM_EMBLEM","ID_WOTC_PHB_ITEM_RELIQUARY"]}]}]},{"id":"wealth","label":"Starting wealth instead","wealth":{"dice":"5d4","multiplier":10,"unit":"gp"}}]},
    {"for":"ID_WOTC_PHB_CLASS_DRUID","options":[{"id":"equipment","label":"Starting equipment","lines":[{"choose":[{"items":[{"id":"ID_WOTC_GEAR_SHIELD"}]},{"picks":[{"label":"a simple weapon","types":["Weapon"],"supports":"ID_INTERNAL_WEAPON_CATEGORY_SIMPLE_MELEE||ID_INTERNAL_WEAPON_CATEGORY_SIMPLE_RANGED","publications":["Player’s Handbook"]}]}]},{"choose":[{"items":[{"id":"ID_WOTC_PHB_WEAPON_SCIMITAR"}]},{"picks":[{"label":"a simple melee weapon","types":["Weapon"],"supports":"ID_INTERNAL_WEAPON_CATEGORY_SIMPLE_MELEE","publications":["Player’s Handbook"]}]}]},{"items":[{"id":"ID_WOTC_ARMOR_LIGHT_LEATHER"},{"id":"ID_WOTC_ITEM_EXPLORERS_PACK"}],"picks":[{"label":"a druidic focus","from":["ID_WOTC_PHB_ITEM_SPRIGOFMISTLETOE","ID_WOTC_PHB_ITEM_TOTEM","ID_WOTC_PHB_ITEM_WOODENSTAFF","ID_WOTC_PHB_ITEM_YEWWAND"]}]}]},{"id":"wealth","label":"Starting wealth instead","wealth":{"dice":"2d4","multiplier":10,"unit":"gp"}}]},
    {"for":"ID_WOTC_PHB_CLASS_FIGHTER","options":[{"id":"equipment","label":"Starting equipment","lines":[{"choose":[{"items":[{"id":"ID_WOTC_ARMOR_HEAVY_CHAIN_MAIL"}]},{"items":[{"id":"ID_WOTC_ARMOR_LIGHT_LEATHER"},{"id":"ID_WOTC_PHB_WEAPON_LONGBOW"},{"id":"ID_WOTC_PHB_ITEM_ARROW","quantity":20}]}]},{"choose":[{"items":[{"id":"ID_WOTC_GEAR_SHIELD"}],"picks":[{"label":"a martial weapon","types":["Weapon"],"supports":"ID_INTERNAL_WEAPON_CATEGORY_MARTIAL_MELEE||ID_INTERNAL_WEAPON_CATEGORY_MARTIAL_RANGED","publications":["Player’s Handbook"]}]},{"picks":[{"label":"two martial weapons","count":2,"types":["Weapon"],"supports":"ID_INTERNAL_WEAPON_CATEGORY_MARTIAL_MELEE||ID_INTERNAL_WEAPON_CATEGORY_MARTIAL_RANGED","publications":["Player’s Handbook"]}]}]},{"choose":[{"items":[{"id":"ID_WOTC_PHB_WEAPON_CROSSBOW_LIGHT"},{"id":"ID_WOTC_PHB_ITEM_CROSSBOWBOLT","quantity":20}]},{"items":[{"id":"ID_WOTC_PHB_WEAPON_HANDAXE","quantity":2}]}]},{"choose":[{"items":[{"id":"ID_WOTC_ITEM_DUNGEONEERS_PACK"}]},{"items":[{"id":"ID_WOTC_ITEM_EXPLORERS_PACK"}]}]}]},{"id":"wealth","label":"Starting wealth instead","wealth":{"dice":"5d4","multiplier":10,"unit":"gp"}}]},
    {"for":"ID_WOTC_PHB_CLASS_MONK","options":[{"id":"equipment","label":"Starting equipment","lines":[{"choose":[{"items":[{"id":"ID_WOTC_PHB_WEAPON_SHORTSWORD"}]},{"picks":[{"label":"a simple weapon","types":["Weapon"],"supports":"ID_INTERNAL_WEAPON_CATEGORY_SIMPLE_MELEE||ID_INTERNAL_WEAPON_CATEGORY_SIMPLE_RANGED","publications":["Player’s Handbook"]}]}]},{"choose":[{"items":[{"id":"ID_WOTC_ITEM_DUNGEONEERS_PACK"}]},{"items":[{"id":"ID_WOTC_ITEM_EXPLORERS_PACK"}]}]},{"items":[{"id":"ID_WOTC_PHB_WEAPON_DART","quantity":10}]}]},{"id":"wealth","label":"Starting wealth instead","wealth":{"dice":"5d4","unit":"gp"}}]},
    {"for":"ID_WOTC_PHB_CLASS_PALADIN","options":[{"id":"equipment","label":"Starting equipment","lines":[{"choose":[{"items":[{"id":"ID_WOTC_GEAR_SHIELD"}],"picks":[{"label":"a martial weapon","types":["Weapon"],"supports":"ID_INTERNAL_WEAPON_CATEGORY_MARTIAL_MELEE||ID_INTERNAL_WEAPON_CATEGORY_MARTIAL_RANGED","publications":["Player’s Handbook"]}]},{"picks":[{"label":"two martial weapons","count":2,"types":["Weapon"],"supports":"ID_INTERNAL_WEAPON_CATEGORY_MARTIAL_MELEE||ID_INTERNAL_WEAPON_CATEGORY_MARTIAL_RANGED","publications":["Player’s Handbook"]}]}]},{"choose":[{"items":[{"id":"ID_WOTC_PHB_WEAPON_JAVELIN","quantity":5}]},{"picks":[{"label":"a simple melee weapon","types":["Weapon"],"supports":"ID_INTERNAL_WEAPON_CATEGORY_SIMPLE_MELEE","publications":["Player’s Handbook"]}]}]},{"choose":[{"items":[{"id":"ID_WOTC_ITEM_PRIESTS_PACK"}]},{"items":[{"id":"ID_WOTC_ITEM_EXPLORERS_PACK"}]}]},{"items":[{"id":"ID_WOTC_ARMOR_HEAVY_CHAIN_MAIL"}],"picks":[{"label":"a holy symbol","from":["ID_WOTC_PHB_ITEM_AMULET","ID_WOTC_PHB_ITEM_EMBLEM","ID_WOTC_PHB_ITEM_RELIQUARY"]}]}]},{"id":"wealth","label":"Starting wealth instead","wealth":{"dice":"5d4","multiplier":10,"unit":"gp"}}]},
    {"for":"ID_WOTC_PHB_CLASS_RANGER","options":[{"id":"equipment","label":"Starting equipment","lines":[{"choose":[{"items":[{"id":"ID_WOTC_ARMOR_MEDIUM_SCALE_MAIL"}]},{"items":[{"id":"ID_WOTC_ARMOR_LIGHT_LEATHER"}]}]},{"choose":[{"items":[{"id":"ID_WOTC_PHB_WEAPON_SHORTSWORD","quantity":2}]},{"picks":[{"label":"two simple melee weapons","count":2,"types":["Weapon"],"supports":"ID_INTERNAL_WEAPON_CATEGORY_SIMPLE_MELEE","publications":["Player’s Handbook"]}]}]},{"choose":[{"items":[{"id":"ID_WOTC_ITEM_DUNGEONEERS_PACK"}]},{"items":[{"id":"ID_WOTC_ITEM_EXPLORERS_PACK"}]}]},{"items":[{"id":"ID_WOTC_PHB_WEAPON_LONGBOW"},{"id":"ID_WOTC_PHB_ITEM_QUIVER"},{"id":"ID_WOTC_PHB_ITEM_ARROW","quantity":20}]}]},{"id":"wealth","label":"Starting wealth instead","wealth":{"dice":"5d4","multiplier":10,"unit":"gp"}}]},
    {"for":"ID_WOTC_PHB_CLASS_ROGUE","options":[{"id":"equipment","label":"Starting equipment","lines":[{"choose":[{"items":[{"id":"ID_WOTC_PHB_WEAPON_RAPIER"}]},{"items":[{"id":"ID_WOTC_PHB_WEAPON_SHORTSWORD"}]}]},{"choose":[{"items":[{"id":"ID_WOTC_PHB_WEAPON_SHORTBOW"},{"id":"ID_WOTC_PHB_ITEM_QUIVER"},{"id":"ID_WOTC_PHB_ITEM_ARROW","quantity":20}]},{"items":[{"id":"ID_WOTC_PHB_WEAPON_SHORTSWORD"}]}]},{"choose":[{"items":[{"id":"ID_WOTC_ITEM_BURGLARS_PACK"}]},{"items":[{"id":"ID_WOTC_ITEM_DUNGEONEERS_PACK"}]},{"items":[{"id":"ID_WOTC_ITEM_EXPLORERS_PACK"}]}]},{"items":[{"id":"ID_WOTC_ARMOR_LIGHT_LEATHER"},{"id":"ID_WOTC_PHB_WEAPON_DAGGER","quantity":2},{"id":"ID_WOTC_PHB_ITEM_TOOL_THIEVES_TOOLS"}]}]},{"id":"wealth","label":"Starting wealth instead","wealth":{"dice":"4d4","multiplier":10,"unit":"gp"}}]},
    {"for":"ID_WOTC_PHB_CLASS_SORCERER","options":[{"id":"equipment","label":"Starting equipment","lines":[{"choose":[{"items":[{"id":"ID_WOTC_PHB_WEAPON_CROSSBOW_LIGHT"},{"id":"ID_WOTC_PHB_ITEM_CROSSBOWBOLT","quantity":20}]},{"picks":[{"label":"a simple weapon","types":["Weapon"],"supports":"ID_INTERNAL_WEAPON_CATEGORY_SIMPLE_MELEE||ID_INTERNAL_WEAPON_CATEGORY_SIMPLE_RANGED","publications":["Player’s Handbook"]}]}]},{"choose":[{"items":[{"id":"ID_WOTC_PHB_ITEM_COMPONENTPOUCH"}]},{"picks":[{"label":"an arcane focus","from":["ID_WOTC_PHB_ITEM_CRYSTAL","ID_WOTC_PHB_ITEM_ORB","ID_WOTC_PHB_ITEM_ROD","ID_WOTC_PHB_ITEM_STAFF","ID_WOTC_PHB_ITEM_WAND"]}]}]},{"choose":[{"items":[{"id":"ID_WOTC_ITEM_DUNGEONEERS_PACK"}]},{"items":[{"id":"ID_WOTC_ITEM_EXPLORERS_PACK"}]}]},{"items":[{"id":"ID_WOTC_PHB_WEAPON_DAGGER","quantity":2}]}]},{"id":"wealth","label":"Starting wealth instead","wealth":{"dice":"3d4","multiplier":10,"unit":"gp"}}]},